"text","stars"
"One of the best fish ever with the most tasty chips.All of the sauce was on point and it really gave loads of flavour","5"
"One of the best fish and chips I've ever had. Mayfair Chippy is a beautiful and quaint restaurant in the heart of Westend, and they serve their dishes just...","5"
"You can't go to England and call it an official trip until you eat some proper fish and chips! Did some research and The Mayfair Chippy looked to be the...","5"
"A superb restaurant, we look forward to going there again when things reopen in London. This place had rave reviews","5"
"Hard to find a way to add any higher praise to the restaurant of the decade in London. Great food, great decor, great folks running it, even great...","5"
"Long wait? Usually. Busy bar? Yup. Worth the hassle?  Absolutely!I've been coming here for years, and by far this is my favorite Indian restaurant in...","5"
"Went to London for vacation and stopped by this  place for dinner! We were originally trying to find nandos (first time trying) but we saw this place across...","5"
"I have visited London a few times now, but I just found out about this place the last time I visited when I was searching for restaurants on Yelp. I was...","5"
"11.1o.19My friend wanted to try this cutesy little place so we arrived right before the line formed so we got to be seated right away. Lucky us.The...","4"
"We came to fat bear for dinner and enjoyed the evening. A highlight for me was the excellent service we received from the team there. Food wise, we tried...","4"
"WOW, this place is delicious!Our family stopped in London for the last part of our cruise.  After touring St. Paul's Cathedral, we were pretty hungry.  We...","5"
"I felt a bit like a genius because I was choosing a place for several friends to meet up and we all wanted different things. I wanted something with at...","5"
"If you take a trip to London you have to visit sketch. The interior design and decor is stunning. Go for high tea or cocktails and get ready to be amazed.","5"
"You come here for the Instagram and the bathroom. It does not disappoint for pictures and the experience, but I found the service and sitting at the bar to...","3"
"Actually only got to make it here for a drink before a night out.  Such a cute place to stop by, but a little pricey of course.  The Gallery Room (all pink)...","3"
"This wasn't the best meal that I've had, but it certainly ranks near the top.  The restaurant felt like it was a little out of the way in a quiet...","5"
"Definativamente me gusta mucho this Michelin three-star restaurant by celebrity chef Gordon Ramsay.  I'm a huge fan of the food and his personality, as well...","5"
"This restaurant absolutely deserves the three stars it has had since 1988! By far one of the best Michelin meals I have ever had!  We went for lunch and...","5"
"I stumbled upon Wahaca walking home from work with a friend, and I am so glad I did! We were drawn in by the trendy atmosphere and patio, and a love for...","5"
"Outstanding food. I would go back to London's just to eat here again. We were so impressed we had appetizers, entrees, and then dessert.Environment: we got...","5"
"I've been to Wahaca twice and have enjoyed both of my visits. Love the casual vibe and the friendly service here. It's open till late, the prices are...","4"
"FFiona's is open and serving the same amazing food as always. We have eaten there several times since the loosening of Covid lock-down restrictions, and...","5"
"This is the perfect place for dinner during this pandemic. Only 9 Tables spaced perfectly for that ""social Distance"" that everyone is talking about.This is...","5"
"I love this place . Small so you feel at home . Fiona was very nice . Everyone was working hard non stop , We had the eggs Benedict special and it was so...","5"
"preamble:  We were in London for four days and we ate at Hawksmoor for three of those days.  It's just that good.  We even purchased their cookbook,...","5"
"Came in especially for the Sunday Roast. Not sure what all the fuss is about??? The service was faultless. The food left a lot to be desired.  The rump...","3"
"I had the most incredible dining experience here! I came here without reservations on a busy weekend. Sat at the bar as I was dining alone and the...","5"
"Super long wait times but the food is incredible. Some of the best brunch I have ever had. We got pretty much the main things from the menu.","5"
"By far one of my most favorite breakfast places in London! If you're in the area I highly recommend making time to go. It's super small inside and its...","5"
"This was a great visit on my trip to London. The area was nice and allows for good sight seeing before or after your meal. The food and coffee were also...","4"
"We got to our hotel somewhere in between early and mid morning and were starving. There weren't many restaurants in the area that were open yet. It was a...","4"
"Is this the diviest great restaurant on planet Earth? If a prison camp in China had a Michelin-level chef in for reeducation, and made him run the mess...","5"
"Lanzhou Noodle is a no frills, reasonably priced Chinese noodle joint located near but not in London's Chinatown. While it may not have much room, the...","4"
"Hands down the best bread and olives combinations that I had in London, beer good however not used to drink it warm, but the experience was worth it","5"
"After exploring London all day, I was trying to find a plaace to eat with my mother who was working in London. I found Queens Arms on Yelp and so glad I...","4"
"First time and London and I just had to get the fish and chips. The Queens Arms gave me everything I wanted in a pub in London:Food: So like I mentioned...","4"
"A great dining experience even in COVID times! We arrived at 4:45 right before they opened to get our name on the waiting app. We went to the pub across the...","5"
"Padella is easily one of my favorite pasta spots in London. I almost ALWAYS go to their Shoreditch location though as it was next to my flat and the wait is...","5"
"I got their beef ragu papardelle to-go. It's not bad, but not the best pasta I've ever had. The beef was tender, but there wasn't a very generous amount of...","3"
"While traveling through London my husband wanted to try traditional afternoon tea and thankfully Yelp led us here! The English Rose is right in the theater...","5"
"Apparently we stumbled upon a pretty popular place for tea for two without knowing it.  Just wanted to get out of the cold weather for a bit and have a cup...","4"
"Very cute place in London. Not a high end tea shop but a a nice alternative if you're looking for a low cost place. Brought my parents here who are not big...","4"
"Been wanting to visit here for years, and whilst I often stay near by I'd never managed it - until today!It's a great tradition London greasy spoon!...","5"
"I have to thank this cafe for introducing me to the traditional English breakfast many years ago. I've tried many since then and although some have been...","5"
"This has been our second time visiting this cafe and we feel that we would be regulars here if we lived in London. It's definitely worth the stroll from the...","5"
"It would be hard to go to London and not dine at Bocca Di Lupo now that I've been here twice (er... technically three times as I came for dinner and later...","5"
"The pasta with mussels is the most delicious thing I've ever tried. Very balanced taste. I would definitely go again. My son also loved his dessert.","5"
"Good food:We ordered the:Chicken scallopini  - great Watermelon, onion and oregano salad - good Courgette flower stuffed with mozzarella & anchovy -...","3"
"Every single time in in London I have to go to the Wolseley. I wish photos would do the place justice. Great food, great atmosphere. Can't wait to get back...","5"
"I experienced my first tea time here a year ago. It is a beautiful place.Afternoon tea time included yummy desserts, sandwiches, scones and tea. We ordered...","5"
"The Wolseley is certainly a grandiose way to ""lunch in London.""Situated in the historic 160 Piccadilly building, this former Wolseley Motors luxury car...","5"
"I always start with the standard slice at any shop to get a feel for their pizzas. This one was phenomenal!The pizza was crispy and the dough was flavorful...","5"
"If my mom suggests, on her own volition, to purchase a whole second pie after having demolished one whole pie (which sufficiently feeds 4 adults), because...","5"
"£4 for a slice of gourmet deliciousness, what's not to like!?Homeslice is a great thin crust pizza place with options for slices or whole pies. Note that...","5"
"10/10 recommend!Good cocktails to have as an aperitif. The NOPI Negroni was very good. The starters are great for sharing with really creative and...","5"
"This restaurant was recommended by my brother-in-law. He owns the chef's cookbook and the recipes are incredible! So we had to try it out. Since it was...","5"
"This is my second time at NOPI and I really was not impressed this time. All the starters were cold and the chickpea omelette fell pretty flat. The sides...","2"
"We loved this place. The food was good, but the service was impeccable. I was surprised by some of the negative reviews, especially about the service. They...","5"
"Food was decent. The Tom Yam Gaang soup was not salty enough and quite spicy. Songkhla Beef curry flavorful but overwhelmed any other flavors. Service...","3"
"A delightful experience for one. I did have to wait outside for a spot, but that is to be expected on a bank holiday. I went wanting spice and they surely...","3"
"Asked the gentleman running the place to give me his favorite menu item, and it did not disappoint. He was very friendly and took his time putting my order...","5"
"Great little breakfast spot London. Our first time visiting London and across the street from our AirBnb was this little gem. Waitress was a super friendly...","5"
"I love the five stars reviews... not because of the food, but because they're the easiest to write.It was our last day in London and shockingly, we hadn't...","5"
"Wow, a great spot. Super busy, even on a Monday night! Be prepared to queue unless you get here early, they have some back bar spots to hang with drinks...","5"
"Oh man, so let me just say, don't count this place out just because there's several locations. It really is like a bit of Spain in London. The items here...","5"
"You know when you have something at a restaurant, and thinking about it days later still makes your mouth water? Whelp, that is how I feel about the Pan con...","5"
"This is one of the few of not only Okonomiyaki places in the UK, and after having lived in Osaka I had to come here, so me and my partner came for lunch of...","5"
"This place was amazing! Some of the best service we have ever received. Our waitress cooked everything for us on the grill. The okonomiyaki was delicious!...","5"
"Its very close to the British Museum. We have had okonomiyaki in Japan. If you are craving for okonomiyaki, this is the place to be. They have tons of...","5"
"The hype is REAL! The Golden Chippy is truly the best fish & chips in London!I'd like to preface this review that I'm the type of diner that does not...","5"
"Nice small place with great service.  I found this place on yelp and since it wasn't to far from our location, we decided to go and try it out.  The...","5"
"Throughout the years, I have had a fair share of fish and chips, but this place is by far the best. Service is outstanding, and staff make one feel like...","5"
"Love this little restaurant!We got the onion soup and the broccoli soup. I liked the onion soup a lot, especially the bread on top. The baguette served agh...","5"
"My girlfriend and I came here for a quick dinner before a show. It's puzzling to read all these rave reviews, which almost makes me wonder if we even dined...","3"
"Don't think you can go there if you love french cuisine, even if there is few good dishes about that, it's not a big deal.The service is quite disastrous,...","3"
"What a great burger, everyone had a great meal and delivery was excellent, not often your food arrived with Uber eats and you don't even have to warm it up...","5"
"In Soho you can find this very nice place to have a good burger of your choice. The bread was outstanding, the fries and the coleslaw were ok. En soho...","4"
"My go-to, especially after a long-haul flight. Do not be deceived by the burger that looks a bit small... it's the perfect portion and comes with a ton of...","5"
"Came here last night for a special xmas dinner with my boyfriend and had two servers: Estella and Simon, they were both so kind, excelled service and lovely...","5"
"I've heard lovely things from others about this place and we were lucky enough to be given a Secret Santa gift card to this restaurant. A bit posh, a bit...","4"
"We ate here over Christmas week.  It was very crowded and busy but our table was ready on time.  Service was a little slow but very accommodating to menu...","4"
"I went 6 years ago around this time. The BEST pot pie I've ever had. I'm from California, meaning I go to whatever British Pubs we have here which are good,...","5"
"Mother Mash was on my list even before I stepped into London for our travels. I had read an article about this place and it had sold me to come here. The...","3"
"Soho is full of culture and amazing places to stroll around, shop & eat! Bubble and squeak is a traditional British breakfast made from boiled potatoes...","5"
"I visited Dishoom during my recent London trip (pre-COVID) and can't wait to go back.I went for breakfast and got the vegan Bombay; it was the best vegan...","5"
"I've thought about this meal at least once a week for the last year.  After telling 3 or 4 friends about an upcoming trip to London, every single person...","5"
"Make sure to get a reservation! Or else you might be out of luck. I don't particularly like Indian/Asian Fusion cuisine, however this is the one place where...","5"
"Unmatched flavors and service!Highly recommended ... if you can get a table!The counter is just as good as a table","5"
"A small crowd began forming in front, an hour before they'd open.  It began drizzling and to escape it I went to a nearby pub but only for a quickie; the...","5"
"A couple of things to keep in mind with this review:1) It has been exactly one year since we dined here during our trip to London (thanks Timehop)2) we...","5"
"Cocktail bar with restaurant at the back. Cool music that makes you want to stay. Very elaborate cocktails with smoke, liquid freezing ice and fire into the...","5"
"The Alchemist is located in the heart of Covent Garden area. One of my local friend recommend this place to me as I really enjoy the different speciality...","5"
"preamble:  This review is lunch for two at 1pm on a Tuesday.  The Alchemist appears to be a serious craft cocktail bar, so expect a completely different...","4"
"Visited London and told the wife that we had to go get a good Sunday roast. Heard about this place on food videos and decided to come check this place out...","5"
"Food: 10/10Service:10/10Wait time: we made a reservation My husband and I came for Sunday roast! We really enjoyed our meal here it was one of our...","5"
"My first Sunday roast was here at Blacklock and I want more!!!Our party of 2 ordered the ""all-in"" which is a combination of beef, pork, and lamb. You must...","5"
"This pizza is very tasty. Definitely recommend this place. Thin crust.  All cooked on a Wood fired grill.I bought the bottomless pizza. 15 pounds. And...","5"
"I've been to 3 Gordon Ramsey restaurants so far and this one would be my 4th. Once again, it did not disappoint! The waitress/hostess was SO friendly....","5"
"We love pizza and really like Chef Ramsey. We had to try this and found it was a unique experience. They bring the pizza to you.  It was like a buffet style...","5"
"I would say I am pretty predictable when it comes to finding ramen places.  I ALWAYS try to go to at least one ramen place wherever I am.  It doesn't always...","5"
"I am so excited to write this review! Today I went to Shoryu Ramen for lunch and from the moment I walked in I knew it was going to be good! I went with a...","5"
"Inside the Kingly Court on Carnaby Street, this ramen place is simply amazing.  First of all my experience there was a 5-star.  The signature ramen was...","4"
"We came here years ago when the restaurant first opened and the only memory from that meal was a chicken dish coming to the table still pink in the middle....","5"
"I would advise you to point to this photo when you visit, order it, and thank me later.This is a delicious restaurant serving food from a region of China...","4"
"I heard so many great reviews about the restaurant and was excited to give it a try! And based on the somewhat unfriendly attitudes of the staff, I thought...","3"
"Great drinks with a cool Atmosphere. The ladies working here were very friendly and readily offered us suggestions, being were visiting the area. Drinks...","5"
"This was such a fun place!  A friend, who's a local, recommended it since it's her favorite spot.  I'd say it has a Jamaican/Caribbean vibe and is in the...","5"
"- One of the top off-island dining experiences when it comes to curried mutton, and they're not afraid ""fi lik yuh wid di flava and wid di peppah"".  I...","5"
"Service was impeccable and we enjoyed the ambiance and the food. Would recommend the strawberry shaved ice!!","5"
"There wasn't much available on the lunch menu. I think it's partly because the economy is just starting to pick up again and restaurants are finally...","4"
"I booked Jinjuu for a celebration family dinner after  postgraduate graduation hoping that they could accommodate 5pp and wouldn't be too noisy or...","5"
"We had an excellent Ramen lunch at Kanada-Ya. Even with CoVid we had a good experience. Thank you to the team!","5"
"10-14-2017Very authentic Japanese restaurant even though the name sounds like Canada. The chef's last name is Kannada and I think that is why the...","5"
"Took a last minute solo trip to London (summer 2019) and did no planning! Did a quick search on Yelp and came across Kannada-Ya; the reviews seemed...","5"
"Yep..fun place.  Lots of historical memoribilia.  Went for dinner after the theater..you really feel like you are in London circa 1940's.  Lots of...","5"
"The true WOW factor at Rules! I have been wanting to dine at Rules for over a decade and after numerous trips to England, I finally made it to London's...","5"
"Yassss to the oldest restaurant still standing  in England established  in 1978 and giving me Cheers/Pub/Poldark/Sherlock/very period  drama made!We had...","5"
"As of food concern, I experienced authentic flavours in the main and the desert. The value for money works great too, roughly £20 per person. The 'must...","4"
"It's been on my list to dine for a long time, and we finally managed it.  We visited there for a light dinner and ordered Cochinita Pibil Tacos and Mole...","3"
"I loved this place! As a Mexican it is hard to find authentic good Mexican restaurants in London. This place tops my list after tonight's dinner. We all...","5"
"Fascinating decor, attentive and friendly service, and the only place in London you can get the DKA - Dominique Ansel's take on the classic Breton ""kouign...","5"
"i am a huge fan of all things DA, this location did not disappoint! the decor was beautiful (treehouse themed as the name suggests) with a bright and airy...","4"
"I am a huge fan of Dominique Ansel! I love his cookbook ""Secret Recipes"" and I love visiting Dominique Ansel London which opened in 2016. I was very...","4"
"I knew from the moment I walked in, that Honey & Co was going to be the kind of place I liked. Small, friendly space and a short menu are both things that...","5"
"Wanted to try a different breakfast option while in London and this breakfast was different from what we are used to, not in a bad way, just different...","5"
"This place is a little small, but it's very popular. We came on a Monday morning for breakfast and we were surprised when they asked if we had a booking....","2"
"Duck & Waffle would make an amazing date spot at night. One of the tallest buildings in London + middle of downtown + transparent windows so you can see all...","4"
"I don't care what any of the negative reviews say, this place is the best. Make a reservation 3 months early when the system opens up. The views, food and...","5"
"I really didn't have plans for my actual birthday since I was going to a show later on the night and having had a massive dinner the night before. But my...","4"
"Dined here in 2016. Interior design is on point - clean lines and modern. Food served is like tapas style. Small plates, reasonably priced. Greek food here...","5"
"Amazing meal at OPSO! Every dish was so tasty- my highlights include the ceviche, feta kataifi, and pita with tzatziki. The octopus was also very good but...","5"
"Aww came here yesterday, and they've opened up an outdoor take out bar! It's very cute. Handwritten signs on cardboard signs for 8 pound cocktails served...","4"
"Such a fun place! Walk in and it's dimly lit and has a bar/club type feel. Then they take you downstairs and you're in an underground tavern/open room type...","4"
"Great food, interior, vibes, and excellent cocktails! A must go restaurant! The pork dish was really good, highly recommend it!","5"
"You arrive excited for some classic Belgian food and then your excitement declines rapidly. First, the wait time to be seated for your reservation was too...","2"
"Well... had to try this high end dim sum place and was not disappointed. - scallop shu Mai - my fave. Really good- har gau - honestly. It's hard to f...","5"
"An unexpected restaurant in London Chinatown neighborhood welcomes you to a refreshing modern Asian food. The decor is very modern and place settings carry...","4"
"Our last stop in London, and quite possibly one of the best one. Treat this as high end Asian tapas, you'll be ordering many, varied small plates and if our...","4"
"What I love about London is how much of a time capsule this city can be.  It's such an interesting city to explore.  One of my buddies from film school told...","5"
"I was so excited to try this place out after discovering it on Yelp looking for historical pubs and traditional British food. It is located right off the...","4"
"This was recommended to us through one of our tour guides and had good ratings in Yelp. It was easy to find through a GPS app and signs clearly sent you...","3"
"Walked past the queues several times, getting more curious each time. On my last attempt the kitchen had just closed. In luck at last and I'm munching my...","5"
"Food: Classic Bao, Fried Chicken BaoInteresting take on Taiwanese bao! The asian fusion approach is cool, and the store has a cute aesthetic. I tried the...","4"
"The best restaurant we tried while traveling throughout London. We ordered 3 appetizers to share for a group of 4 people and each ordered 2 baos and we were...","5"
"A famous and busy mayfair retreat clad in green and an unmistakable venue with what you expect from this established modern day classic Italian restaurant...","5"
"loved the place, the service & the food. I came many-times what stands out is rice salad, burrata, tagliatelle a la salmon, lobster spaghetti, crab...","5"
"Great pizza and super nice staff - I was the last person in the restaurant and they didn't even make me feel rushed. Love the ambiance here.","5"
"Catching up on reviews. Went for lunch in February; my last trip abroad before COVID lockdowns. Absolutely fantastic. I hadn't planned to go, but after a...","5"
"Service was excellent. Went for a birthday and had a great time! Thought rice and flesh was a little too salty after a while. But that's my only issue....","4"
"Dinner by Heston Blumenthal is located inside the Mandarian Oriental hotel. We arrived a few minutes before opening time at lunch, so the bartender took our...","5"
"Stopped at the restaurantMight be the best italian experience in londonThe beef roast was absolutely tastyAnd seafood phenomenal","5"
"Excellent food, excellent service in a very classy setting. Had truffle mushroom risotto to start with cheese and was delicious. Also bread board which was...","5"
"dropped bottled water on my pants and shirt, but still charged me for it? like enough water that i needed two cloth napkins to clean upvery pushy for...","2"
"I'm sad this is temporarily closed... they must be remodeling. This was one of my most memorable memories in London. The finger sandwiches and macaroons...","5"
"This review is for afternoon tea at the Pavilion, which is the location to go since the Orangery is being renovated right now.  We reserved a spot, but...","4"
"What's a trip to London without having afternoon tea? We got the royal tea and that was amazing. It tastes a little like earl grey and that's my favorite....","4"
"Love this place!! The dry lamb karahi is probably my favorite dish there. Lamb for me is a hit-or-miss at restaurants but at Tayyabs they definitely do it...","5"
"Warning. If there are clothes you love, do not wear them here. It'll end up smelling like the spices there for a couple days, if not a week. And just for...","4"
"Still the best Indian food I've had in my life so far!!! The queue will be at least 45 minutes during dinner time so get ready to wait.Grilled Lamb Chops...","5"
"Such a beautiful restaurant! I felt like I was walking into Christmas and the food was also delicious.","5"
"The ambiance is so good. Wow. SO romantic.I HATE their 'reservation' system, but I can't knock this place any stars because when we FINALLY did get in (on...","5"
