"text","stars"
"Sophie's is a steakhouse type of restaurant with a contemporary ambience and very cool vibes. It is located in Soho and a stone throw's away from many major...","4"
"Went here for breakfast and I was surely in for a treat. I ordered the full english breakfast and it packed a ton of flavor. The baked beans were like...","5"
"I love visiting London - but usually struggle with finding great food. After several mediocre meals - we found Sophie's. It was by far the best meal I've...","5"
"The first place we ate after traveling to London. The pizza was good different than what we are used to in the US. On that note the crust was nice and...","4"
"We were just walking around looking for somewhere to eat and we saw (and smelled) this place. It smelled good and it was good. The pizza was on point. I...","5"
"Great Pizza.  Owners are from Turin Italy in the Piedmont region.  Super friendly customer service.  I said it was my first time there and waitress...","5"
"The Masgouf itself is awesome, yet I would recommend for them to abandon using sea bass. Iraqi Kabab is nice, but the portion is tight.","4"
"Love the grilled lamb!! That's nice.Randomly choose dish of the day and it turns out to be a nice one! Both fish and rice are super delicious. Thank you...","5"
"I want to give this place 4.5/5 but don't have this option.I had a chance to come back and try the masgouf and mixed mezza plate.I must say, the mezza...","4"
"Amazing spot for a take-away sandwich!I had a Ox Tongue in Rye bread which I liked a lot as meat was tender and quite a lot for £5.90. Service is quick and...","5"
"Fairly well executed salt-beef sandwich. This is a corned beef with rye bread. The beef is good, not great. It has a firm texture but does break apart...","3"
"I am such a fan of this establishment and visit every time I can. The salt beef and tongue go so well together. I recommend a mix of these two in your...","5"
"Delicious food! Super friendly and helpful staff!Absolutely wonderful experience, will most definitely eat here again when I'm in town.","5"
"Date of Visit: 02.10.09 ""Pure Treasure - Great Chef with great passion""Review: You first enter and feel that it is both casual and reasonably lively and...","5"
"So good! This place has amazing pastries and coffee/tea AND their breakfasts are served all day (sooo yummy). We got their chili lime avocado toast...yum!!...","5"
"Forest on the Roof was a magical experience. It's cool to even just take the elevator up, because there's a woman waiting there to escort you to the front....","4"
"Great rooftop restaurant. Came here for a girly catch up as i didnt book i had no idea this place existed on the rooftop of Selfridges...please note i...","3"
"Horrible service!!  The service was not only bad & slow but the servers are rude, dismissive and condescending too.  I can overlook people learning or busy...","3"
"Scottish Egg and Venison - Delicious Michelin starred pub in Fulham LondonI took an Uber on a rainy Friday night through slow London traffic, and it was...","5"
"One of my favorite meals in London! In my research for best food in London, I saw online that this was the only pub with a Michelin star in London. This...","5"
"Everyone knows that when in London, you gotta find yourself a proper English Sunday roast, or you might as well not bother traveling to this city at all....","5"
"This Pizzeria di Camden is A M A Z I N G. From hospitality to the freshness of their ingredients. The staff was very welcoming and helpful with explaining...","5"
"I popped into here last night and got the Verdura for takeaway. It's a white pizza with a nice assortment of veggie toppings. I realized after I had already...","4"
"I had a good feeling about this place when I saw them advertising real Neapolitan pizza, and their use of San Marzano tomatoes. And the wood-fired oven....","5"
"Straight forward Italian food whose name translates to '19' which is also its street address is safe as houses. It would have received a 3 star rating but...","2"
"Food and service was fantastic!   Homemade pappardelle pasta!  And omg the tiramisu!  So heavenly!  Fantastic service from our waitress to help us pick our...","5"
"This restaurant was such a pleasure! Our server, Giuseppe, was so attentive, friendly, and helpful. All of the food was extraordinary: the meat platter for...","5"
"I can't really fathom how long I've been jonesing to do Indian curry in London, proper. I have more than my share of conversations about food, and this is...","5"
"This restaurant is fantastic. Went with my mom and sister on vacation. I was expecting a run-of-the-mill experience and was completely blown away by how...","5"
"Delicious homemade Indian food. We were staying in the neighborhood and looking for a bite of Indian. The service was good. Tip: The led light fixtures can...","5"
"As far as vegan or vegetarian options go, this place is a home run!It's imply one of the best vegan restaurants I've been to, and the attitude of the lady...","5"
"This place is cute, but not super great. I can see why it would be attractive to vegans or anyone who wants to eat  a vegan meal. It does have a great...","3"
"One of the best vegan scrambled I've had, especially not a tofu-based scramble. The food was hot and delicious, and the atmosphere was lovely. Will def come...","4"
"This cafe was larger than expected boasting many tables seated safely apart. Ordering was done via your phone and there was hand sanitizer for each...","4"
"I've never eaten anything like this before! It was a great experience but probably would never crave it again. I felt like I was biting into a cloud. The...","3"
"Please note that the Yelp address saying ""1 Byng Place"" is incorrect. The Google address of Unit 8, Brunswick Centre is correct.I came here on a weekday...","4"
"My hometown has one. The menu and food is good. The chicken is sublime really as well. Recommended for birthday meals out. You can get a decent meal for a...","5"
"TLDR: HALAL, yummy and affordable casual dining with a menu focused on Portugese/African chicken! Chicken plates, sandwiches, veg options, and plenty of...","5"
"Nandos knows chicken and it knows it damn well!Nandos is an institution and has provided many happy spicy chicken-filled hours for the nation. It may not...","5"
"We came here for dim sum since I haven't had dim sum in forever. I thought the service was fine (but then again, I spoke Chinese to them so I think that...","4"
"We came here on a weekend, and had a pretty bad experience. The wait was good as it was only for about 15 minutes, but besides that, almost everything else...","2"
"The service here was helpful and welcoming and the dim sum was just as I'd expect at a good restaurant.The roasted pork bao was probably my favorite....","5"
"i was in town with a coworker on valentine's day so everywhere was packed and overflowing with people. we were lucky to stumble upon this restaurant and...","5"
"Very tasty new chicken joint in London. The chicken is a little bit on the smaller side but very good. Tried the lemon and garlic but will be back to try...","4"
"If you are thinking to eat chicken, dont miss that place. Nice atmosphare, good service and food","5"
"Very nice Latin American restaurant with good ambient and service. I had many plates that I shared (Chicken Empanadas, Chicken Skewer en Mole, Pork Belly...","4"
"We stumble upon this restaurant by chance and I highly recommend it. We tried a few different items from the menu. The Plantain chips with guacamole, the...","5"
"Amazing food.  I highly recommend the fried plantains with guacamole and please do not forget the blue corn churros.  Mmmm... mmmmm.","5"
"We grabbed coffee at The Roasting on our first day visiting London. We each got a cappuccino and a muffin. The coffees were delicious and the pastries...","5"
"Quite small, but the coffee was the best we had in the UK. Obviously a neighborhood place with mainly locals, and got can see why. We had a croissant with a...","5"
"The Roasting is already a favourite of locals in the area.And for good reasons:philosophy is simple:Keep it fresh. Keep it local. Keep guests coming back...","5"
"From decor to service, it lives up to its reputation.The food was just perfectly cooked and you won't be disappointed by the portion size either. I'd...","5"
"The food and atmosphere of this Chelsea favorite are wonderful. Many of the staff have been there for more than 20 years, with some as long as 35. Their...","4"
"Good service and location. The food taste nice here. I'd like to give 4 stars. It would be better if the lobster spaghetti has more sauces.","4"
"This place was the bees kneeeees!! We were visiting London, and randomly made reservations at this location because it was walking distance from our...","5"
"Very cosy restaurant. The best seats IMO are by the counter, where you can watch the kitchen make their pasta dishes. Make sure you reserve a table for...","3"
"Man! My fellow English Yelper peeps and our trusty app did it AGAIN! 3rd day in the fabulous city of London. Whilst enjoying a brisk tour of the Tower of...","5"
"Central London is often cramped and busy with crowds constantly in-your-face, but this venue, rumored to have been converted from an old hospital, is super...","5"
"My team had breakfast here during the week, and it was a very nice and beautiful restaurant for this purpose.The food was good, but the portions were a...","3"
"Highly Recommend: Crispy Squid and Cucumber Cocktail.I was recommended this by a local and it did not disappoint.  Honestly, from the pictures online I...","5"
"Good food at a reasonable price, the place was quiet on a Thursday night after our first day in London and a miserable trip (two cancelled flights, lost...","3"
"Left touristy London and took a quick bus to La Luna based on the great rating and decent pricing listed on Yelp... Boy,  we were not disappointed! So good!...","5"
"My boyfriend and I are here one our last day in London and it was amazing! It's cute little family owned joint with amazingly fresh and deliciously tasting...","5"
"After a water tour on the Thames， we were ready for a nice lunch.   One person in our large party had eaten here previously and enjoyed it. Service was a...","4"
"After a fun morning of seeing the sights in Westminster, my fiancée and I were in great need of warming up on a snowy London day. Thankfully, Footstool...","5"
"Inside St Johns Crypt is a very pleasant restaurant which opens daily for lunch as well as for special events and performances in the church above. Under...","4"
"I ordered the tomato almond pesto on grain pasta, it arrived with a single tomato adorning the top, and tomato mixed in with the pesto sauce. The thinly...","4"
"Had a lovely lunch at Enzo's! Luigi was a great waiter and our food was so delicious. I am sure I won't be eating the rest of the day because we had the 2...","5"
"Possibly the best food we had all week in London! Having grown up in a Sicilian family, this food met all expectations and then some. The fennel salad was a...","5"
"Came here on a Sunday night and was able to get a table easily. I ordered the Tom yum soup, which was delicious, with a fragrant broth and good flavor. For...","5"
"The Little Thai is a cute, small restaurant with large artwork at the back and tables that is situated opposite the bar. A visit to the toilet reveals an...","4"
"Good quality Thai food - very sumptuous and delicious but still very light on the stomach - points towards being authentic Thai. We ordered a red Thai curry...","4"
"We were planning on going to Entrecote, but the line (even late on a Thursday) proved to be too long so we ended up at this little cute-looking Italian...","5"
"I had heard good things about Caldesi in the US and wanted to try it, especially because they have gluten-free pasta.  The service was exceptional and the...","4"
"The food and service was good. We expected more based on previous, although older, reviews.","3"
"My group of friends and 2 coworkers of my Brother in law picked this spot per the awesome reviews from here, maps, and trip advisor. We showed up with a...","5"
"When I saw timeout recommend it as the best kabob in the city, I modified my pre-theatre plans for a detour. The website described a compelling happy...","3"
"TL:DR Great kebabs, really expensive BEST KEBABS EVER! However, it's crazy expensive for a kebab. If you're looking to bring friends from out of town into...","4"
"This is one of my favorite places to eat in London.The tuna tartare with caviar was just wonderful. And also the foie gras sushi and the mackerel. Could...","5"
"UMU was such a pleasant experience. The food and the service were impeccable, and it was definitely a well-deserved Two-Michelin star restaurant. UMU is...","5"
"Umu definitely takes the cake when it comes to food, service, and experience. I've been to several Michelin star restaurants and Umu is definitely on par or...","5"
"Worth the hype! Ordered takeout during lockdown and it came with instructions on how to prepare/reheat/garnish your food, plus a recipe for masala chai (how...","5"
"Just WOW. The Dishroom was beyond delicious with perfect portions and an entire allergen menu. This was one of my favorite meals from my time in London. The...","5"
"Of all the Dishoom locations, Shoreditch might be my favorite. Their terrace is gorgeous and makes brunch that much more fun. I usually go for brunch and...","5"
"A perfectly curated selection of international cheeses and wines with gorgeous Italian produce, products, and snacks. Admittedly, I've only shopped in the...","5"
"Absolutely the best falafel, best pitta and best aubergine I've ever had. There was a lengthy queue outside as the nearby offices were on lunch but it moved...","5"
"Happy people working here. Awesome music and vibe. So many great flavors in the falafel: pickled onions, pickles, crispy falafel balls, bulgur, peppers,...","5"
"""At the age of 29 years old I had a vision, maybe the only thing that will give gramps peace of mind, is that I keep the falafel coming...Pilpel was born.""...","5"
"A great stop for drinks and eats.Swung by here for a quick snack and drinks. They close after 3 to get ready for the dinner service, so if your'e in the...","4"
"I've been here for multiple reasons and all were amazing. The homemade pasta here is soooooooo good. Get the rigatoni with the boar ragu. And really random,...","5"
"Delicious. Was in London for the weekend and wanted to go to a nice dinner with my best friend. We found this place and decided to make a quick reservation...","5"
"TLDR: Great grub for a great cause!____Came in expecting fish and chips. Had chips (fries) but no fish. They had actully revamped thier concept a few...","5"
"After a long day of exploring and jet lag, we found the Brigade thanks to Yelp down the block from our hotel. They recently went thru a rebranding, and...","5"
"Nice spot for a quiet breakfast and a pot of tea. Seats by the window are great for people watching. The avocado toast comes on a good slice of sourdough,...","4"
"I love the steak here.  Overall it is a really nice venue with excellent service, a good atmosphere, interesting drinks and fantastic food.","5"
"Very lovely place. There are bar seats where you can sit and watch all the cooking action, or you could choose to relax on a lovely curved sofa table, which...","5"
"Right in the heart of the shopping district on Conduit street just inside of Regent street, is the new Japanese restaurant founded by Yoshihiro Murata, who...","5"
"Oh my!  Still one of my most delicious favorites in London!  Even a 20 minute walk will not keep me from getting my favorite sandwich.  With extremely...","5"
"Small place, huge flavor!  The food was fantastic and prepared by a lovely staff.  Portions were large and the prices were very fair.  I'd love to go back,...","5"
"This place is so great that I need more time and energy to write a long review. Just go here and enjoy every morsel!","5"
"A fantastic meal to kickstart our London experience.  Across from the Victoria and Albert Museum. We ordered around the menu and it was all delicious....","5"
"Well I have dined at Orsini 5 times over a period of a year. Each time my dinner exceeded my expectations. The pastas are home made. The risotto with beet...","5"
"Upon wondering the streets of London and having already eaten an incredible amount of chips that day, we opted for a new cuisine. Italian. Orsini was...","4"
"This place is amazing for many reasons and I am happy to share all of them. The food: I ordered the salmon and garlic bread. Seems simple right? Wrong. I...","5"
"Ok, so definitely won't be seeing a Gondola passing through with the striped shirt Gondolier or anything hahaha. Like seriously, I don't know what these...","4"
"The best thing about this cafe is it's location. It sits on a bridge spanning a canal and you get a clear view down the waterway. It's a lovely spot. We...","4"
"This was my first experience with Indian food and it did not disappoint. The menu is set up ""tapas""- style is the only way I can relate it to. The bread is...","5"
"we ate here twice on our recent London trip. Food was excellent. Great portions and flavors. Nice staff. Very interesting casual food. Good drinks and beer...","5"
"I'm am Indian food junkie. This place is beyond incredible. The complexity of the favours is absolutely mind boggling. The head chef Manoj is a superstar....","5"
"Absolutely love the food, drinks, ambiance, and PEOPLE!As a tired and fresh-off-the-plane traveler, I found Heist Bank nearby Paddington. And what a find....","5"
"I've now had the opportunity to eat here a few times and have come to really enjoy it. This place is definitely an unassuming diamond in the rough. The...","5"
"Excellent waitress! Excellent food! Excellent beer! Heist was just what we needed after a busy day touring London. Our waitress was friendly and helpful!...","5"
"105A Edgware Road - all Shawarma lovers must forever commit this address to memory for at last, at long last a decent Shawarma place is uncovered in the...","5"
"I don't know if it was the fact that I was drunk and it was 2 am, but the shwarma here is amazing. It's a little hole in the wall but for 5 GBP, you get a...","5"
"Not great shawarma Bad attitude from the person who was making it , no gloves, pray to god I won't have E. coli diarrhea.","1"
"Ooooh this one's a good'un. If two Qype captains insist that a pub is good, you can bet they're right. But ooooh they've outdone themselves with this...","5"
"Great pub, I must like it as I go there almost every Sunday. The selection of ales is very good, I always try any new ones. The Sunday lunch is very tastey,...","4"
"One of what London lacks - a really good neighbourhood boozer with bags of character. A no-nonsense lunch menu ( burgers or ""tapas"", although the latter...","4"
"INTROLebanese cuisine has not tickled my fancy like Al Balad and so with delight comes my raving review. Yes, this will be as fair as possible seeing as...","5"
"Incredible find on my visit in London.  Perhaps some of the best middle eastern cuisine I've enjoyed.  Will be coming back on my next visit to London.","5"
"This place serves outstanding Lebanese food, and best of all, they open late. The chicken shawarma is one of the most flavorful and moist chicken I've had...","4"
"I went in for a good sushi meal on my own and ordered some Yakitori, the mushroom soup and a chef's mix. When the waitresss accidently gave my Yakitori to...","5"
"Worst food Ever! Hands down! Ordered to go and got to home see this inside a bowl of oil! And I asked for No AVOCADOS and they purposely put them inside!...","1"
"It was overall delicious, but I was waiting for the bill for some time. The servers were busy chatting to each other.","3"
"We ate there on a quiet Wednesday night. Homey atmosphere. Service was well-informed and attentive.We went for the 9-course and wine pairing. Some dishes...","5"
"We went for the 9-course menu, which surprisingly did not feel like too much, as the cooking is quite light. The dishes ranged from 'so-so' (a monkfish) to...","4"
"AMAZING place, the tasting menu is insane, definitely the best restaurant I've been to in London for a long while.","5"
"Really good food--what more can you ask for?  Pad See Eiw with duck and roti/red curry.","5"
"This place is situated on a street with soooo many other amazing looking restaurants. Competition baby! Anyway, back to Siam.My husband and I finally...","4"
"A friend brought me here for a quick Wednesday night dinner and I was surprised to see the restaurant packed full! It was an omen of the good food to come....","5"
"I have had afternoon tea at quite a few places, including a couple in London, and the Swan's was by far my favorite!The atmosphere is perfect, elegant but...","5"
"First off, what a location! You get a gorgeous view of the city from its windows in certain parts of the pub, and the interior is beautifully lit to create...","4"
"Located right next to The Globe, I figured this would be a tourist trap given its location but it was one of the only places open at 9pm on a Sunday...","4"
"Georgian cuisine is some of the best food out there. Now, I'm spoiled living in New York with a plethora of options, but coming to London I actually found a...","4"
"3.5 stars. Overall, I loved Georgian cuisine, but similar to Russian restaurants (that I'm very familiar with due to being from Russia), I'm not a big fan...","3"
"My first thought upon walking into this quiet, spacious, casual and homey restaurant was that  this is the perfect place to take the rents out for a meal....","4"
"What great value!  Food is fresh, fast and delicious.  Super reasonable prices.  Had a vegan lentil quinoa stew which came with a delicious bread roll....","5"
"If you had told me that I was going to have lunch in a church cafeteria while visiting London, I would have told you that you were crazy. Somehow, searching...","5"
"Stopped by here after a tour of London to grab a quick bite to eat. The staff here are all very nice and welcoming. Prices are good, though the food is...","3"
"Hawksmoor is very busy, because it is very casual for an expensive steakhouse and the food is very good. The salad was very small for the price--or almost...","4"
"We went to this establishment because I wanted to try a Sunday roast.  We arrived with a reservation around 1 PM. The restaurant was clean, well decorated,...","4"
"We stumbled into this place one night thinking it was another restaurant we had gone to years ago while visiting. It was raining so we decided not to...","5"
"Authentic and excellent. I had the chicken tikka two ways, which was brilliant. Tender thigh meat (none of that god-awful dry and tasteless breast meat that...","5"
"I've always heard that London has great Indian food, so I was excited for Masala Zone, but that wasn't the case here. We started out with Goan Crispy Fried...","3"
"Beautiful restaurant and excellent service, but the food, ehh. We ordered the vegetarian punjabi samosa, garlic naan, chicken korma and lamb rogan josh....","3"
"Fantastic service and food all around. The fish game in particular was on point. Arriving at 6pm, the place really began picking up at about 6:30 and got...","5"
"Every dish from the bread, make your own salad, appetizer, plats to dessert, EXCELLENT! Attentive service and wonderful atmosphere. Lovely Sunday family...","5"
"Tonite I was taken advantage of more blatantly by a waiter in a restaurant than ever before in my entire life. My husband and I went for a special dinner...","1"
"BEST. CHICKEN. EVER! So good! I thought I'd be underwhelmed given that this restaurant is a chain, but boy was I wrong. I love that they have a variety of...","5"
"Came here for some Portuguese chicken. We didn't realize it was counter order and get your own plates, drinks, and utensils. We got the 10piece chicken...","4"
"I had been dying to go to Nandos and this one was right by our hotel. The hostess was very friendly and helpful. We had the full chicken with the mango and...","5"
"So far this is the best Mexian restaurant I have found in London. But, like one of the previous reviews said, this is more tex-mex than authentic Mexican...","4"
"Great food and drinks and really nicely decorated. Spice warnings work a little differently than in other places - there's no 1, 2 or 3 chilis icon, just...","5"
"I happened to stay near Mezcal, in Dalston.  The dishes are described very authentically.  I normally eat local cuisine when I travel but with a place with...","5"
"I trusted the Yelp reviews and they were right.After spending a day at the museums I was starving. I walked over and ordered an XL mixed grill. The...","5"
"Tight little joint that the food is packed with flavor! Bring cash but if you forget, they are patient and trusting for you to return right away. The Doner...","5"
"I ordered the mixed grill. Overall, I really enjoyed it. The lamb and sausage pieces were my favorite. Also comes with a salad and a piece of pita bread on...","4"
"Love Primrose Hill, and this is a great pub in the middle of it. Really nice feel when you walk in, welcoming and relaxed at the same time.Great selection...","4"
"We came to the princess after hanging out in the park on a Thursday night after dinner. They have a good beer selection, strong cocktails and good snack...","5"
"Very nice neighbourhood pub ..  food is good atmosphere nice ... dog friendly ..  glad I live nearby and it's part of my local selection ..  scallop starter...","4"
"Amazing service! Tequila shots were wonderful :) Gustavo was a great bartender. He made great recommendations for drinks and was very helpful in helping us...","5"
