"text","stars"
"Great spring and duck rolls!! Lovely cultural atmosphere right by Great Portland underground station. Air conditioning was superb and staff was kind....","4"
"Love this place, in fact, it's the best Chinese Restaurant my partner & I have found in London!Great food, well prepared, truly authentic, not too pricey,...","4"
"London is full of Greek cuisine, but Mazi has been my favourite for quite some time. Inspired by the foods of old Greece, this charming restaurant brings...","5"
"What an experience! A modern take on Greek food. They started us off with an amazing passion fruit spritzer ""welcome shot"". Then we ordered the eggplant...","5"
"Excellent and intimate modern Greek cuisine... my brother in law (who is Greek) found this place via Yelp! I believe. It is located near Kensington Gardens,...","4"
"This is the only thing open after 11PM it seems on this side of London . Not like NYC where you can get a full course meal at 6AM . But the pricing is...","4"
"Right around the corner where I'm staying, pretty quick and fresh you can see themCook in front of you. Give these guys a go instead of your local dominos...","4"
"Decided to try the place out since it was about a 2 minute walk from our flat. My room mates and I wanted to try restaurants that were unique to London...","4"
"We decided to stop in for lunch in the middle of our work week and we were thrilled with the experience. The ambiance is hip and trendy and the service was...","5"
"Recommendations:+ Make a reservation it is well worth it. + Ask the server which food is good.+ Order a Spiced Masala Chai with Rum (Y-U-M)Honestly...","5"
"This is an Indian fusion restaurant owned by a couple of brits. The chef is an Indian who used to work at a famous hotel in Bombay. It is certainly not your...","4"
"Went there their first day opening up after covid. The staff was really eager to be back. You could feel it in their service. Almost a bit too eager. They...","4"
"Cool Japanese izayake with Korean flavours.Went for the tasting menu of 38£ which is a the best deal   to sample their menu at a good price.The tasting...","4"
"Wow... in an expensive city, I was not expecting this place in Soho to be exorbitant with its pricing.Sure,you expect it at places like Sexy Fish or...","2"
"Now if you're going to go eat kanafa you need to get it from a Palestinian joint. Off the Baker Street train station and near the madam Wax museum I saw a...","5"
"I am not sure how this place got such a high rating - the food is sub-par at best, it is surprisingly expensive for what you get (11 GBP), and the service...","2"
"We were staying nearby at an AirBnB in the lovely Marylebone neighborhood in November 2018 and noticed this little gem while walking from the Tube (and the...","5"
"If you are looking for traditional English food and drink this is hands down the spot. I love that this pub serves beer in a caste (something that is...","5"
"Starving and chilled, we wandered into the White Hart looking for a warm meal and a drink. This quaint pub is full of charm and the food and service are...","5"
"Came here for our first night out in London and we had a blast! It was so much fun and the bartenders Victoria and the two other men were very helpful,...","5"
"One of the most unusual restaurants I've ever had the pleasure of eating in.   First, was looking to try an Indian place on Brick Lane but we had landed a...","5"
"If you want to have dinner here, you need to come in the afternoon and put your name on the list. You'll receive a link via text that lets you track the...","4"
"Gunpowder is small, but mighty. A newer addition to the Shoreditch food scene, so expect a wait. Thankfully, there are lots of bars around to wait after you...","5"
"Some of my favourite Thai in the city. Will often get food for takeaway when working late. The menu is reasonably diverse while also being very reasonably...","5"
"I walked in the rain braving Storm Dennis to eat here, so I guess I had high expectations. However, here are the issues I had:Service: The server (Kevin,...","2"
"Small little thai restaurant in the heart of soho. This place is so good, and not $$$$! I got the yellow curry (forgot the menu name) with tofu and the...","5"
"A lovely place right by St Pauls. Great Lunch Deal, especially if you are vegetarian.The decor is nothing special- not very Vietnamese. The price was a...","4"
"Their beef pho literally cured my hangover. 10/10 experience. Cannot stop thinking about it","5"
"Opened just a few weeks ago, this little Vietnamese take-away place enriches the Charlotte-Street area in Fitzrovia with yet another culinary adventure. I...","4"
"Ahh this place is sooo adorable!! It's decorated all in pink, with flowers on the outside of the building as well as inside. It's well-lit and looks really...","5"
"Ordered their lobster roll/burger/truffle fries etc..It is just so-so, no big extraordinary deal in taste.Quite hyped-up in my honest opinion.A little...","3"
"We found this location next to our Hotel at Canary Wharf. We liked it so much we ate their twice (we usually try to hit as many local, unique places while...","5"
"The chain is right next to china town and it is connected to W hotel. We got the Classic roll, and Singapore chili roll and shared it between two people....","4"
"On our way to Logan Airport, we ate at our favorite Italian restaurant in Boston. After all, with a week holiday planned in England, we weren't expecting to...","5"
"Food was delectable and so tasty we finished every last bite. However we got pretty ill later that night so I'm not sure how fresh the ingredients are or if...","4"
"Excellent, home-like atmosphere. Friendly staff. The Paccheri Mamma Mia was rich and creamy, the prawns were delightful. Overall pleasant experience. Would...","4"
"I was drawn to the sign of the White Mustache, which seemed completely out of place in the warren of generic flat-blocks that fill the space between...","5"
"Great food at a good price. Some of the best Thai I've had! Right off the main road, this place had a good variety of options and good portion size for the...","5"
"We came around 9pm, got seated right away. The food came out pretty quick. Everything tasted good. We ordered selection appetizers, fried rice, beef...","4"
"Loved everything about this restaurant from the service to the food. Came on a Tuesday night for a date night with my husband. We made a reservation...","5"
"This was my second brunch since moving to London and it didn't disappoint. The pictures of this place did it justice. From the neon light sign and...","5"
"Very good American BBQ restaurant. I had Mutton Tacos which meat was really good but toppings could have been better (there was pretty much no Feta) and...","4"
"You best be ready to sit on benches at this hipster restaurant because that's all there are.We went here in search of sticky toffee pudding, having seen...","5"
"Amazing Persian food, friendly service, and even better it's BYOB but note that there is a £10 corkage charge which is pretty standard in the U.S. and...","5"
"Very friendly family run restaurant.  I was pleasantly impressed with the food here.  I ordered Sultani Kebab and Joheh Kabab, one of the best I had in...","5"
"Totally hated this place.The biggest pre-food issue was the tinny shitty music they were playing on what sounded like a mobile phone from 2005, all...","2"
"The first dinner for our London vacation was at 1-Michelin Quilon, which happens to be right next to our hotel!  The cuisine here is SW Indian, meaning it...","5"
"Came here with the worst guy ever ralph. Actually, surprisingly I really didn't enjoy the food at the restaurant (neither of us did). At first they brought...","2"
"The absolute best Indian food I've ever had. It was fancy and different from the usual Indian food (chicken tikka, lamb saag, etc.). I expected to get some...","5"
"Swanky, upscale restaurant and bar. Lots of bar space. Extensive cocktail menu, bottled beer, many wines and spirits. Great for groups and business parties....","5"
"Gem! Incredible atmosphere! This is a very reasonably priced restaurant that feels like it should be more expensive. The service was great! The food was...","5"
"For his birthday, my friend's only wish was to come here for an omakase and I cannot stop thinking about it! I had to make about 200 calls to get a...","5"
"If you have watched Jiro sushi on Netflix.  This is probably about as close as you get to it.  Only a few seats available in each seating and it is probably...","3"
"DELICIOUS! After calling 180 times (not an exaggeration), I finally got a reservation for what was a lovely dinner. Bear in mind my expectations for the...","5"
"This is my favorite wine bar anywhere.  Not just in London, but worldwide.  They specialize in lesser known vineyards that nevertheless deliver fantastic...","5"
"Really lovely neighbourhood wine bar. Guaranteed amazing wine whatever you order. Staff know the stuff and if they haven't tried something they will look it...","5"
"Within the craziness that is London, this is a quaint oasis! We came here just before 10 on a Saturday night, enticed by a simple yet inviting interior,...","5"
"Don't arrive early or you'll be sorrier than a cracked crustacean's claw. Kitsch sticky menus needed a bit of explanation and if the menus change regularly...","4"
"If you're looking for great, fresh seafood and a quirky dining experience, The Lobster Pot is a good choice. This small french restaurant in Kennington...","4"
"My wife and I chose this place for our last dinner in London before heading back home to DFW. I had read about this restaurant in some top 10 lists for...","5"
"Before an upcoming London trip, I'd wanted to try classic British cuisine in an upmarket setting. I found Holborn Dining room from a google search, and...","5"
"This is the definition of ""splashing out."" In no  other world would you pay £22 for a steak and kidney pie...or any pie. Having sampled said steak and...","4"
"A perfect place to have British food with elegant flare. The meats and seafood are terrific. Fantastic service through the whole night! You gotta get some...","5"
"http://www.varunmurali.com/blog/kitchen-tableFavorite dishes: Oyster, Bread, Lobster, Sweetcorn, BlackberryDishesWe started with a tiny glass of...","5"
"I've eaten at some pretty spectacular restaurants. It's something that I truly enjoy, and I'm willing to invest the money in exchange for an experience that...","5"
"Probably one of the best meals I have ever had in my life, definitely in my top three. It's an amazing experience to watch chefs in their element. The...","5"
"Wow, what a find!Served here is Chinese Xinjiang cuisine, from the western highlands near Tibet. Lots of lamb, a bit shy of beef and no definitely pork....","5"
"Nice flavours, open late, great area, cute place! I liked their drunken noodles!","4"
"I love how this restaurant has a kids menu - a starter and a main for 6.50. The kids loved their fried rice and pad saw eww. The only compliant they had was...","3"
"Small Thai restaurant located in Carnaby. Our top choices were packed and wait listed so we went here as an outdoor table opened up. I would say that...","3"
"Good price, good taste, good nutrition. Compare to a regular fast food restaurant, Greek is a lot more healthy so this is our to-go place if we don't want...","5"
"Decent food, nice restaurant and kind staff. We came to Bill's for breakfast on what might have been one of the last sunny days of London for summer '19....","5"
"I went to 3 different Bill's restaurants during my couple of months staying in London. The decor is incredible- beautiful Gastropub details. The menu is...","5"
"One of my fav places in London. The most beautiful room. Friendly staff with attentive service. And the food was amazing. Fresh. Filling. And unique.","5"
"When in London, eat as the British do. Was looking for a great fish and chips spot close to our hotel in Hyde Park and Queens Arms we chose and off we went!...","5"
"Picked this place large largely at random after spending an afternoon at the Natural History Museum. I will start by saying the door is a push and not a...","4"
"First off, food was divine. Never really had sausages & mash or proper fish and chips. We expected grizzlier pub food, but this food really hit the spot....","4"
"Consistently outstanding food and service! Something for everyone on the menu. Excellent apps and entrees: creative, top ingredients, best recipe , and...","5"
"Great spot. The decor is really nice and makes for a nice place to enjoy brunch with friends.We were excited to go for the bottomless mimosa special for...","4"
"I am rounding up from 2 stars because i'm being generous. I think my first few visits were far better than this last one. I hope it's the case they had an...","3"
"No result by searching Hong Kong style cafe in yelp but pass by this today and give it a try. Taste is not bad for my beef curry rice and they also have a...","4"
"I made the mistake of ordering pizza from here. It's really really good, and I lived across the street.... so it was kind of a problem.","4"
"This place is really good and also have us really great service. My group of 5 all loved our various dishes and beverages. The previous review about them...","5"
"Delicious Italian food but did not honor the yelp coupon, just looked at it said ""no we don't do those ""","3"
"That Wagyu though! Swung by here at the tail end of my trip in London. Showed up around 8 and got a seat at the bar without any wait on a Tuesday night....","5"
"This place was amazing! I went there for date night with my husband and we both left having enjoyed our meals a lot! We ordered the crispy tofu and miso...","5"
"They Just opened so I understand the restaurant still may be getting some things fine tuned .. and I will start with this the Sushi Absolutely amazing along...","3"
"I used yelp reviews to find this place. The wife and I are at the Paddington Hilton so thanks to the guy who left a positive review that also stayed there....","5"
"I was in London staying at the Paddington Station Hilton Hotel for a 24 hour layover. I was coming from Greece on my way back to the United States. I asked...","5"
"NoorJahan is great neighborhood Indian restaurant.  It is located in Paddington and has sidewalk seating as well as indoor, air conditioned seating.  On the...","5"
"Hands down the best meal I've had in London and one of the best experiences in my life. I am SHOCKED this does not have a Michelin Star. Everything about it...","5"
"Chefs table with wine pairing. Absolutely amazing from start to finish. Presentation of the food - fantastic. Service and education of wine pairing...","5"
"Is there a seven star optionI live 8 time zones away and would return just for another night dining here Did the 5 course tasting menu and could easily...","5"
"Bill's is a cute little place near Covent Garden Market, although it's still far enough away that you can actually see its doors through the foot traffic...","5"
"We enjoyed our family dinner very much! Super cute restaurant with cozy casual atmosphere. Menu  was diverse enough to satisfy adults and kids. Also a...","4"
"Amazing food. Calamari was nice and crispy but a little too spicy for my liking. I wished it was a red sauce and not a white dipping sauce. I got the sea...","4"
"Found this place on Yelp and it's just a quick walk from my hostel.  I was lured in by the pictures. The salad and chicken looked fresh, so i ordered the...","5"
"This was great!  The waitstaff were extremely friendly.  We couldn't decide between kebab or fish and chips, so we found a place that had both!  My mom had...","5"
"The hummus and falafel here was delicious and tasted different from the ones in the US. I got the fish burger, which was crispy and tasty. My friend got the...","5"
"My dish felt like an American-British fusion breakfast. I ordered crushed avocado, smoked salmon, and poached egg. I was given a generous amount of each....","5"
"Wow.   It is extremely rare that when I am on vacation that I eat in the same place two days in a row.  After all, you are on vacation and you want to try...","5"
"Not knowing a UK bacon sandwich is ONLY a thin slice of pork belly between two slices of bread is my fault. Later I did spot a BLT on the indoor menu, but...","2"
"Just amazing Turkish food and the most hospitable service! Still thinking about those dips!","5"
"The exterior as well as the interior is great, it's clean, cozy and elegant. A nice mix of modern and authentic. The waitress who took our order is the...","4"
"Wonderful meal with family and friends. Group of 10. Great food. Everyone was impressed. All winners and no losers.","5"
"Top place , every time I visit from Miami I go there . It's like a must , always good vibes and nice crowd!","5"
"Came here for Sunday lunch and was able to book with an hour's notice - the name seems to have changed from the new inn and the place seems to have a mix of...","4"
"Coming from California, we have tons of good burgers like Habit, In'n'Out, and Hook Burger, so when wandering the streets of London late at night and a...","5"
"I really didn't intend to eat a hamburger on my trip to London, but I was starving and Honest burgers was open pretty late and not too far from my hotel....","4"
"Ate here on our trip to London, it was the closest to where we were staying. We had just had burgers the day before but were starving so we grabbed a bite...","3"
"Undoubtedly one of the best burgers I think I have ever had!This is a pretty interesting establishment, as other reviewers have observed, the site of an...","5"
"Occupying the site of an old pub (The Black Horse), Byron Proper Hamburgers dishes out just that: hamburgers done properly and without a hint of pretension....","4"
"So the usual bugs exist in any place that has just opened, so I'm not going to focus on how one of the burgers was served cold, it took nearly 20 minutes to...","4"
"As a small disclaimer, I should confess my ignorance here. I've never been to Thailand, sadly have no Thai friends, and have never even knowingly attempted...","3"
"What a cracking little find this is! Busy at 6.15pm might have something to do with their recent review in The Sunday Times by my fave food writer, Marina...","5"
"This restaurant has delicious food. I wish I took a photo before I got started. Very friendly staff, too.","5"
"The food was delicious! And what a special find on a quiet street. Very spacious and comfortable. I loved that there was a plug to charge up and the lamb...","5"
"Wonderful restaurant the food was great the service was fantastic our server Mimi (probably spelling was wrong of his name) was wonderful they treated us to...","5"
"Had lunch at Yasmeen last week...Ambiance is beautiful and clean. Our table of 6 sat under the glass roof which was super nice.Service is friendly and...","3"
"This has been my go to spot during my visit. Exceptional food and the best staff in london. They have dj's on the weekends and a incredible atmosphere. I...","5"
"A restaurant doesn't score 5 stars for being perfect - no no, 5 stars are reserved for that ideal mix of great food and feel within its own self-selected...","5"
"A great quick Thai spot, with food ready in 2 minutes. We ordered the Green Curry chicken and veg, and the Pork Chu Chee, both with brown rice. Tons of...","5"
"excellent food great service simple yet delicious.  i recommend taking a walknover and grabbing some good curry","5"
"Good place in London for thai food. Cheap prices also.The service was very kind. We had the pad thai and the red curry with coconut steamed rice. Food...","4"
"Love this place....popped in for a quick bite. Service was outstanding. Shared green curry with steamed rice, and Jasmin tea... delicious and very...","5"
"Great food and service! Small and quiet restaurant, location is just far enough from the tourist crowd but still easy to find. Food was delicious. Drinks...","5"
"Lovely little restaurant serving delicious Persian cuisine.  The kebabs were very juicy, the salad and mast-o- khiar were tasty and the rice fragrant and...","5"
"The food here was delicious! My friends and I sat outside because we didn't get a reservation. But it was totally fine! The three of us shared the lamb...","5"
"My friend and I had dinner here last week. Small place, very intimate. Lovely decor and background music. Our server (I think Aussie?) wasn't the...","4"
"Every pence I dropped here was worth it. This place and their food was delicious . Their Knefeh had me like ""damm bruh!"" and it was soo good that I did not...","5"
"Just wandered into this little place on Edgeware Road and wondered if it would be good because it was quite empty.It was superb. I had the chopped salad...","5"
"So good!  The lamb was tender and juicy... all dishes were perfectly seasoned and delicious!  They didn't appear to have air conditioning so was a little...","5"
"We were in London for only four nights, and we came here... three times!  Yes, after touring all around England and finding mostly pleasant but unremarkable...","5"
"Came here for the sunday roast and had a good time. The food was delicious and we tried some good beer. Note that almost everything is self service. We...","4"
"Great bar featuring a nice selection of craft beers from the UK. It's nice to switch it up if you're looking for something besides Fuller's beers. The place...","4"
"I've never been to Iran or Bombay which is the kind of food that Dishoom serves up so am I the forefront expert on it? No - but delicious food is delicious...","5"
"You can believe the hype people- been coming to Dishoom for many years. It's a classic go-to when thinking of great Indian food at an excellent value for...","5"
"I've heard so much about Dishoom and finally had the opportunity to dine here with my friends. Their restaurant pays homage to Irani cafes with a Bombay...","5"
"At first I went into that other bagel shop. There was no one else there, I stood there a couple minutes, had some employees look at me and then away, so I...","5"
"I was ATTACKED physically in this shop. I walked in on a video phone call to show my friend what to order, and a man (pretending to be) on crutches yells:...","1"
"Two bagel shops on Brick Lane right next to each other, I picked the one with the shorter line.  Bagels aren't as good as NY but were decent.  The meat was...","4"
"Locale was one of my favorite dinner stops while my mom was visiting me in London. She's a bit of a picky eater, but the menu here had enough variety (and...","5"
"Found this after London Eye! It was a great surprise! Excellent service and even better food! Take your time and enjoy all the courses!","5"
"My favorite restaurant of our entire Europe trip. The carbonara is so rich and creamy and amazing OMG. It's the best thing I have ever put in my mouth....","5"
"Oh. This was a nice surprise!I'd visited the Tottenham lots of times because it is sooo convenient (right outside Tottenham court road station) and...","4"
"The Flying Horse is a traditional pub on Oxford Street, opposite of Tottenham Court Road underground station. The decor is fairly stylish, and there's a...","4"
"We had a couple of hours free before our visit to fight the Martians in War of the Worlds at the Dominion Theatre and needed a beverage. We found this...","4"
"What a wonderful experience! I have only eaten at one or two other sushi places I have enjoyed more! I'm only visiting for four days but I will be back!","5"
"A very good and authentic Japanese restaurant with menu in Japanese and real Izakaya food. We ordered a lot of different dishes to share and everything was...","5"
"This is one of the hidden gems in the city. However, it is quite popular among Japanese, because I tried to book this place for a couple of time and it was...","4"
"I ate here for dinner last night and ordered the mustard aubergine. It was delicious and fairly priced: a sweet and savoury dish that left me feeling not...","4"
"We were in London couple of weeks ago and stumbled upon this place while looking for our dinner options...and glad we did! Wonderful food and a very warm...","5"
"Really excellent modern Indian tapas. I tried the cauliflower and the lamb chops. Both were delicious albeit a little expensive. People who try more should...","5"
"Good Polish restaurant with a nice and simple ambient below the arches. Food is conveniently priced, tasty and comes in big portions. They also have a good...","4"
"Such a great find by our hotel.They have only been open for a month but they have great things going for them.. Namely awesome Polish food, banging beers,...","5"
"Came in hungry after a London bus tour.  This place was next to the hotel I was staying at, so thought I'd give it a try.  Had the lunch special and had the...","4"
"It has been so long since I was in London. I became extremely busy and therefore, have not updated any reviews in so long. My memory may not be great, but...","5"
"The ambiance and interior design of this restaurant is a hidden gem within London's Chinatown. There is plenty of seating and a large selection of items on...","5"
"my friend and i met up to eat cakes for brunch then changed plans around 12pm but they didn't open until 12.15 which wasn't much of a wait! but they only...","4"
"THE MOOD: The Athenaeum is a five star London hotel in the heart of Mayfair and Piccadilly. Only a short walk from both Hyde Park & Green Park tube station....","4"
"Afternoon is $39 per person, and the tea they have is really awesome. For afternoon, I will said normal not that special. The environment is elegant and...","4"
